{
  "schema": "KC144.ActiveEpochCrosswalk.V7",
  "epoch_id": "EPOCH-B-EIGHT-BLOCK",
  "epoch_census": "6+16+21+37+10+15+27+12",
  "kc15": {
    "runtime_view": "CARDINALITY_GRADED",
    "canonical_view": "BINARY_LSB_FIRST",
    "entries": [
      {
        "runtime_gid": 91,
        "canonical_gid": 91,
        "support": [
          "11"
        ],
        "runtime_station": "{11}",
        "canonical_label": "Support Mask 1000",
        "relation": "IDENTITY"
      },
      {
        "runtime_gid": 92,
        "canonical_gid": 92,
        "support": [
          "10"
        ],
        "runtime_station": "{10}",
        "canonical_label": "Support Mask 0100",
        "relation": "IDENTITY"
      },
      {
        "runtime_gid": 93,
        "canonical_gid": 94,
        "support": [
          "00"
        ],
        "runtime_station": "{00}",
        "canonical_label": "Support Mask 0010",
        "relation": "TYPED_PERMUTATION"
      },
      {
        "runtime_gid": 94,
        "canonical_gid": 98,
        "support": [
          "01"
        ],
        "runtime_station": "{01}",
        "canonical_label": "Support Mask 0001",
        "relation": "TYPED_PERMUTATION"
      },
      {
        "runtime_gid": 95,
        "canonical_gid": 93,
        "support": [
          "11",
          "10"
        ],
        "runtime_station": "{11,10}",
        "canonical_label": "Support Mask 1100",
        "relation": "TYPED_PERMUTATION"
      },
      {
        "runtime_gid": 96,
        "canonical_gid": 95,
        "support": [
          "11",
          "00"
        ],
        "runtime_station": "{11,00}",
        "canonical_label": "Support Mask 1010",
        "relation": "TYPED_PERMUTATION"
      },
      {
        "runtime_gid": 97,
        "canonical_gid": 99,
        "support": [
          "11",
          "01"
        ],
        "runtime_station": "{11,01}",
        "canonical_label": "Support Mask 1001",
        "relation": "TYPED_PERMUTATION"
      },
      {
        "runtime_gid": 98,
        "canonical_gid": 96,
        "support": [
          "10",
          "00"
        ],
        "runtime_station": "{10,00}",
        "canonical_label": "Support Mask 0110",
        "relation": "TYPED_PERMUTATION"
      },
      {
        "runtime_gid": 99,
        "canonical_gid": 100,
        "support": [
          "10",
          "01"
        ],
        "runtime_station": "{10,01}",
        "canonical_label": "Support Mask 0101",
        "relation": "TYPED_PERMUTATION"
      },
      {
        "runtime_gid": 100,
        "canonical_gid": 102,
        "support": [
          "00",
          "01"
        ],
        "runtime_station": "{00,01}",
        "canonical_label": "Support Mask 0011",
        "relation": "TYPED_PERMUTATION"
      },
      {
        "runtime_gid": 101,
        "canonical_gid": 97,
        "support": [
          "11",
          "10",
          "00"
        ],
        "runtime_station": "{11,10,00}",
        "canonical_label": "Support Mask 1110",
        "relation": "TYPED_PERMUTATION"
      },
      {
        "runtime_gid": 102,
        "canonical_gid": 101,
        "support": [
          "11",
          "10",
          "01"
        ],
        "runtime_station": "{11,10,01}",
        "canonical_label": "Support Mask 1101",
        "relation": "TYPED_PERMUTATION"
      },
      {
        "runtime_gid": 103,
        "canonical_gid": 103,
        "support": [
          "11",
          "00",
          "01"
        ],
        "runtime_station": "{11,00,01}",
        "canonical_label": "Support Mask 1011",
        "relation": "IDENTITY"
      },
      {
        "runtime_gid": 104,
        "canonical_gid": 104,
        "support": [
          "10",
          "00",
          "01"
        ],
        "runtime_station": "{10,00,01}",
        "canonical_label": "Support Mask 0111",
        "relation": "IDENTITY"
      },
      {
        "runtime_gid": 105,
        "canonical_gid": 105,
        "support": [
          "11",
          "10",
          "00",
          "01"
        ],
        "runtime_station": "{11,10,00,01}",
        "canonical_label": "Support Mask 1111",
        "relation": "IDENTITY"
      }
    ],
    "bijection": true,
    "relocated": 10
  },
  "kc27": {
    "runtime_view": "SIGNED_XYZ",
    "canonical_view": "TERNARY_ABC",
    "entries": [
      {
        "gid": 106,
        "station": "P00",
        "runtime_xyz": [
          -1,
          -1,
          -1
        ],
        "canonical_abc": [
          0,
          0,
          0
        ],
        "transform": "(a,b,c)=(z+1,y+1,x+1)",
        "exact": true,
        "canonical_label": "Semantic Coordinate 000"
      },
      {
        "gid": 107,
        "station": "P01",
        "runtime_xyz": [
          0,
          -1,
          -1
        ],
        "canonical_abc": [
          0,
          0,
          1
        ],
        "transform": "(a,b,c)=(z+1,y+1,x+1)",
        "exact": true,
        "canonical_label": "Semantic Coordinate 001"
      },
      {
        "gid": 108,
        "station": "P02",
        "runtime_xyz": [
          1,
          -1,
          -1
        ],
        "canonical_abc": [
          0,
          0,
          2
        ],
        "transform": "(a,b,c)=(z+1,y+1,x+1)",
        "exact": true,
        "canonical_label": "Semantic Coordinate 002"
      },
      {
        "gid": 109,
        "station": "P03",
        "runtime_xyz": [
          -1,
          0,
          -1
        ],
        "canonical_abc": [
          0,
          1,
          0
        ],
        "transform": "(a,b,c)=(z+1,y+1,x+1)",
        "exact": true,
        "canonical_label": "Semantic Coordinate 010"
      },
      {
        "gid": 110,
        "station": "P04",
        "runtime_xyz": [
          0,
          0,
          -1
        ],
        "canonical_abc": [
          0,
          1,
          1
        ],
        "transform": "(a,b,c)=(z+1,y+1,x+1)",
        "exact": true,
        "canonical_label": "Semantic Coordinate 011"
      },
      {
        "gid": 111,
        "station": "P05",
        "runtime_xyz": [
          1,
          0,
          -1
        ],
        "canonical_abc": [
          0,
          1,
          2
        ],
        "transform": "(a,b,c)=(z+1,y+1,x+1)",
        "exact": true,
        "canonical_label": "Semantic Coordinate 012"
      },
      {
        "gid": 112,
        "station": "P06",
        "runtime_xyz": [
          -1,
          1,
          -1
        ],
        "canonical_abc": [
          0,
          2,
          0
        ],
        "transform": "(a,b,c)=(z+1,y+1,x+1)",
        "exact": true,
        "canonical_label": "Semantic Coordinate 020"
      },
      {
        "gid": 113,
        "station": "P07",
        "runtime_xyz": [
          0,
          1,
          -1
        ],
        "canonical_abc": [
          0,
          2,
          1
        ],
        "transform": "(a,b,c)=(z+1,y+1,x+1)",
        "exact": true,
        "canonical_label": "Semantic Coordinate 021"
      },
      {
        "gid": 114,
        "station": "P08",
        "runtime_xyz": [
          1,
          1,
          -1
        ],
        "canonical_abc": [
          0,
          2,
          2
        ],
        "transform": "(a,b,c)=(z+1,y+1,x+1)",
        "exact": true,
        "canonical_label": "Differential, Cohomological, and Boundary Calculus"
      },
      {
        "gid": 115,
        "station": "P09",
        "runtime_xyz": [
          -1,
          -1,
          0
        ],
        "canonical_abc": [
          1,
          0,
          0
        ],
        "transform": "(a,b,c)=(z+1,y+1,x+1)",
        "exact": true,
        "canonical_label": "Addressing, Random Access, and Seed Retrieval"
      },
      {
        "gid": 116,
        "station": "P10",
        "runtime_xyz": [
          0,
          -1,
          0
        ],
        "canonical_abc": [
          1,
          0,
          1
        ],
        "transform": "(a,b,c)=(z+1,y+1,x+1)",
        "exact": true,
        "canonical_label": "BR21 Peer Runtime"
      },
      {
        "gid": 117,
        "station": "P11",
        "runtime_xyz": [
          1,
          -1,
          0
        ],
        "canonical_abc": [
          1,
          0,
          2
        ],
        "transform": "(a,b,c)=(z+1,y+1,x+1)",
        "exact": true,
        "canonical_label": "IC10 Promotion-Compiler Index"
      },
      {
        "gid": 118,
        "station": "P12",
        "runtime_xyz": [
          -1,
          0,
          0
        ],
        "canonical_abc": [
          1,
          1,
          0
        ],
        "transform": "(a,b,c)=(z+1,y+1,x+1)",
        "exact": true,
        "canonical_label": "CUT Branch-Complete Navigation"
      },
      {
        "gid": 119,
        "station": "P13",
        "runtime_xyz": [
          0,
          0,
          0
        ],
        "canonical_abc": [
          1,
          1,
          1
        ],
        "transform": "(a,b,c)=(z+1,y+1,x+1)",
        "exact": true,
        "canonical_label": "Codec, Compression, and QSHRINK"
      },
      {
        "gid": 120,
        "station": "P14",
        "runtime_xyz": [
          1,
          0,
          0
        ],
        "canonical_abc": [
          1,
          1,
          2
        ],
        "transform": "(a,b,c)=(z+1,y+1,x+1)",
        "exact": true,
        "canonical_label": "Memory, Merkle, and Content Addressing"
      },
      {
        "gid": 121,
        "station": "P15",
        "runtime_xyz": [
          -1,
          1,
          0
        ],
        "canonical_abc": [
          1,
          2,
          0
        ],
        "transform": "(a,b,c)=(z+1,y+1,x+1)",
        "exact": true,
        "canonical_label": "Semantic Coordinate 120"
      },
      {
        "gid": 122,
        "station": "P16",
        "runtime_xyz": [
          0,
          1,
          0
        ],
        "canonical_abc": [
          1,
          2,
          1
        ],